{
 "schemaVersion": 2,
 "contractMigration": {
  "schemaId": "event-sensitivity.v2",
  "previousSchemaId": "event-sensitivity.v1",
  "fromSchemaVersion": 1,
  "toSchemaVersion": 2,
  "breaking": true,
  "policy": {
   "document": "docs/SCHEMA_VERSIONING_POLICY.md",
   "policyVersion": 1,
   "decisionRule": "language-subset",
   "note": "判定は新旧 2 つの schema だけで行う。artifact の中身は見ない"
  },
  "consumerAction": "**schemaVersion で分岐すること。**1 を期待する実装は 2 を受け取ったら停止する。中身（イベント深さの幅・basis・spreadStatus）は v1 から変わっていない。**artifact の配布名は変わらない**（sensitivity.trs_jack_trs.json 等）。",
  "renamedAssets": [
   {
    "from": "event-sensitivity.v1.schema.json",
    "to": "event-sensitivity.v2.schema.json",
    "reason": "schema ファイル名。artifact 側の名前は変わらない"
   }
  ],
  "history": [
   {
    "shippedIn": "v0.4.0",
    "previousRelease": "v0.3.0",
    "previousSchemaPath": "schemas/event-sensitivity.v1.schema.json",
    "currentSchemaPath": "schemas/event-sensitivity.v1.schema.json",
    "schemaVersionAtTheTime": 1,
    "schemaVersionShouldHaveBeen": 2,
    "versionWasHeld": true,
    "policyVerdict": "BUMP",
    "recordedRetroactivelyIn": "v0.5.0",
    "changes": [
     {
      "kind": "enum-value-added",
      "effect": "WIDEN",
      "schemaPointer": "/properties/provenance/properties/inputFiles/items/properties/role/enum",
      "instancePath": "$.provenance.inputFiles[].role",
      "added": [
       "input-scope"
      ],
      "reason": "入力の範囲定義 source-input-scope.v1.json が入力になった。**追加のみだが、旧 schema を pin した consumer はこの値を拒む**"
     }
    ]
   },
   {
    "shippedIn": "v0.5.0",
    "previousRelease": "v0.4.1",
    "previousSchemaPath": "schemas/event-sensitivity.v1.schema.json",
    "currentSchemaPath": "schemas/event-sensitivity.v2.schema.json",
    "schemaVersionAtTheTime": 2,
    "versionWasHeld": false,
    "policyVerdict": "BUMP",
    "changes": [
     {
      "kind": "const-changed",
      "effect": "UNDECIDABLE",
      "schemaPointer": "/properties/schemaVersion/const",
      "instancePath": "$.schemaVersion",
      "from": 1,
      "to": 2,
      "reason": "版を上げた。**下流はここで分岐して止まる**"
     },
     {
      "kind": "field-added",
      "effect": "WIDEN",
      "schemaPointer": "/properties/contractMigration",
      "instancePath": "$.contractMigration",
      "added": [
       "contractMigration"
      ],
      "reason": "**この schema には対応表が無かった。**v0.4.0 で契約を変えたのに記録が残っていなかった原因の一つ"
     },
     {
      "kind": "constraint-tightened",
      "effect": "NARROW",
      "schemaPointer": "/required",
      "instancePath": "$",
      "added": [
       "contractMigration"
      ],
      "reason": "対応表を必須にした。**旧 artifact は新 schema で落ちる**"
     },
     {
      "kind": "enum-value-added",
      "effect": "WIDEN",
      "schemaPointer": "/properties/provenance/properties/inputFiles/items/properties/role/enum",
      "instancePath": "$.provenance.inputFiles[].role",
      "added": [
       "contract-migration"
      ],
      "reason": "版と契約変更の対応表の正本 contract-migration.v1.json が入力になった"
     }
    ]
   }
  ]
 },
 "generatedBy": "npm run sensitivity:events",
 "variantId": "TRS|JACK-TRRS",
 "analysisScope": "EVENT_DEPTH_SPREAD_ONLY",
 "sweptParameters": [
  "trrs.jack.contact.sleeve.axialCenter",
  "trrs.jack.contact.narrowPadWidth"
 ],
 "generatedFromCommit": "d0f3b219e522629ae30e4dbe667738165e63b861",
 "provenance": {
  "generatorVersion": 4,
  "generatedFromCommit": "d0f3b219e522629ae30e4dbe667738165e63b861",
  "workingTreeDirty": false,
  "revisionOverride": false,
  "artifactKind": "release",
  "inputDigestAlgorithm": "sha256",
  "inputDigest": "bb320df496157af2badb246bfb33b9f86fea846c051c90a0e13201607e072c2f",
  "inputDigestScope": "先頭に \"setting  <key>=<value>\" を key 昇順で 6 行置き、続けて inputFiles を path の昇順に並べ、\"<sha256>  <path>\" を改行で連結した文字列の sha256。setting 行は**ファイルに現れない variant 固有の設定**で、これが無いと variant 間で digest が同一になる。**生成される artifact 自身は含まない。**",
  "inputSettings": {
   "variantId": "TRS|JACK-TRRS",
   "sweptParameters": "trrs.jack.contact.sleeve.axialCenter,trrs.jack.contact.narrowPadWidth",
   "axialRangeMm": "0.45..4.55",
   "padRangeMm": "0.01..5",
   "divisions": "30",
   "stepMm": "0.02"
  },
  "inputFiles": [
   {
    "path": "contract-migration.v1.json",
    "sha256": "f27ce53531e00880146b917e9df9cb0042b0ea63b0a096afcf2108604686b520",
    "role": "contract-migration"
   },
   {
    "path": "package-lock.json",
    "sha256": "64dc625a9cc34c83b4321d47147e12537455be06a09331ce4bfa968239dda72d",
    "role": "lockfile"
   },
   {
    "path": "schemas/event-sensitivity.v2.schema.json",
    "sha256": "e9cd21c7cb09e496aa9e5609e126493e06871e0bac99cf9dcec79f8d8e7f80ce",
    "role": "schema"
   },
   {
    "path": "scripts/contractMigration.mjs",
    "sha256": "a8b62087dc36cad3aa21d24de9ac4b93c4a4fc5700f784146f6d89f977e9b21e",
    "role": "generator"
   },
   {
    "path": "scripts/measurementGate.mjs",
    "sha256": "1be8f4248f43bbe14f0f0e34bd68c0875d2cfc5d840a50ab93ec63a3d3cbcef5",
    "role": "generator"
   },
   {
    "path": "scripts/provenance.ts",
    "sha256": "ad943f639e4cd9531fc13f1bc549ad891a8f3247911f66c21bc712fca6062f00",
    "role": "generator"
   },
   {
    "path": "scripts/sensitivityEvents.ts",
    "sha256": "57fa90ae653f687a1438f6417e6db15e2dfc742890096e3f857fe496d132bdea",
    "role": "generator"
   },
   {
    "path": "source-input-scope.v1.json",
    "sha256": "ba7a855da4a06cd05f99a5387ab6537d741339d2b6c3aa86b06bd4454161dd43",
    "role": "input-scope"
   },
   {
    "path": "src/data/dimensions.json",
    "sha256": "318f0bb993030e0ebe936e21adb2ea4e952f5e0a7a18709e4227bc8a1e56dee7",
    "role": "model-data"
   },
   {
    "path": "src/data/faultPresets.json",
    "sha256": "ee586e1bf7e15b55398e148612b9ef6ad4b1f98a849d455d477b1c65a97f70ff",
    "role": "model-data"
   },
   {
    "path": "src/data/index.ts",
    "sha256": "1c2922b6698713f72c241b6f49809e3654ee909ddd94116cad6f90a57f124dd4",
    "role": "model-data"
   },
   {
    "path": "src/data/jackContacts.json",
    "sha256": "52e255dfbb3d0344b1aa922ac8092518395ed441c9ce69dcf7274434a19349db",
    "role": "model-data"
   },
   {
    "path": "src/data/jackContacts.trrs.json",
    "sha256": "f5443dcdda800abef9b928fde166f1930393f2e85c59b50851906d910e0d8e8f",
    "role": "model-data"
   },
   {
    "path": "src/data/materials.json",
    "sha256": "709bd006cc055bd44058c40f6ca8011c81e04ce3e795297e6edfeeebadb7889c",
    "role": "model-data"
   },
   {
    "path": "src/data/plugSegments.json",
    "sha256": "7d51e6f5a5a3961fca92039e217bf631a78e779a7fe1847078e3dd42a2347102",
    "role": "model-data"
   },
   {
    "path": "src/data/plugSegments.trrs.json",
    "sha256": "f5715e080d34a29fd93ab4f0a5e4bdc14d47cf77a5bc199c3b5ce8b7fb509ce2",
    "role": "model-data"
   },
   {
    "path": "src/data/sourceReferences.json",
    "sha256": "b21590bdb56f65343c99512fad0ecd72b2c9200ed234b12f8428843dfa8f40de",
    "role": "model-data"
   },
   {
    "path": "src/model/circuit.ts",
    "sha256": "bfc407f8921aaf230cc736c6a368f9490d59f0da9acca16dabfbc9ba49ca3025",
    "role": "model-code"
   },
   {
    "path": "src/model/contact.ts",
    "sha256": "e4a4e78b14fd2f7d1c0148a968617d4eb9c8395ed1f08b4e3eae355d31a4ae67",
    "role": "model-code"
   },
   {
    "path": "src/model/engine.ts",
    "sha256": "7ecd30ba22d3b587f8782c7469e1c9cfedcb6fc5b098436e0e75b902c0b938aa",
    "role": "model-code"
   },
   {
    "path": "src/model/force.ts",
    "sha256": "1f6bc966eba29a27091d7d55afc278a365396aa690302b0492d3a5734e9974c1",
    "role": "model-code"
   },
   {
    "path": "src/model/resolve.ts",
    "sha256": "73e197830e9c0b5f7e46ffedba781f3689fd8e21fbc73ad63cea955075d1a7cb",
    "role": "model-code"
   },
   {
    "path": "src/model/sweep.ts",
    "sha256": "bb88036fd8d757e652b66f36861b3b72a4abc6e9fd0f501761c785ff0a5472a4",
    "role": "model-code"
   },
   {
    "path": "src/model/topology.ts",
    "sha256": "12203873d4c89084734cd4cc2e6de4b139aaa3000bf8651f9bf8c1dd7db5cac9",
    "role": "model-code"
   },
   {
    "path": "src/model/types.ts",
    "sha256": "9f4770aad4e05cdf0f3f2a4e3ad4a91992a76b91dac8cbf5a0df4975b3131e70",
    "role": "model-code"
   }
  ],
  "command": "npm run sensitivity:events -- --variant \"TRS|JACK-TRRS\" --release",
  "artifactDate": "2026-10-18"
 },
 "generatedAt": "2026-10-18",
 "basis": "MODEL_PARAMETER_SWEEP",
 "note": "モデル内部の感度であって、実物のばらつきでも製造公差でもない。帰線接点の軸位置とパッド幅を同時に振り、完全挿入が成立する構成にわたって主要イベントの深さの最小・最大を集めたもの。",
 "sweep": {
  "axialRangeMm": [
   0.45,
   4.55
  ],
  "padRangeMm": [
   0.01,
   5
  ],
  "divisions": 30,
  "stepMm": 0.02,
  "configurationsTried": 961,
  "configurationsUsable": 341,
  "buildFailed": 0,
  "fullInsertionNotOk": 620,
  "shippedValues": {
   "trrs.jack.contact.sleeve.axialCenter": 1.25,
   "trrs.jack.contact.narrowPadWidth": 0.5
  },
  "shippedInsideSweptRange": true
 },
 "byKind": {
  "FIRST_BREAK_OPEN": {
   "minMm": 7.82,
   "maxMm": 8.64,
   "configs": 341,
   "movesMm": 0.82
  },
  "FIRST_BRIDGE": {
   "minMm": 9.02,
   "maxMm": 13.12,
   "configs": 341,
   "movesMm": 4.1
  },
  "FIRST_ELECTRICAL_CONTACT": {
   "minMm": 1.18,
   "maxMm": 5.28,
   "configs": 341,
   "movesMm": 4.1
  },
  "FIRST_PHYSICAL_CONTACT": {
   "minMm": 1.18,
   "maxMm": 5.28,
   "configs": 341,
   "movesMm": 4.1
  },
  "FIRST_WRONG_SEGMENT": {
   "minMm": 1.18,
   "maxMm": 5.28,
   "configs": 341,
   "movesMm": 4.1
  },
  "FULL_INSERTION": {
   "minMm": 14,
   "maxMm": 14,
   "configs": 341,
   "movesMm": 0
  },
  "LAST_CONTACT_RELEASE": {
   "minMm": 1.18,
   "maxMm": 5.28,
   "configs": 341,
   "movesMm": 4.1
  },
  "STATE_CHANGE": {
   "minMm": 1.18,
   "maxMm": 13.96,
   "configs": 9080,
   "movesMm": 12.78
  }
 }
}
